"This was a great movie with a good story. My children (10, 7, 5, and 4) all loved this movie, including myself. The music was also fantastic. No, the horses do not talk, but instead, the story is told by Spirit. And to hear a story told by a horse's point if view was fun.<br /><br />I think the title says it all, ""spirit"". This movie really gives you a sense of family and home and friends. I would have to say my 4 year old boy and 5 year old girl were really touched by this movie, and even got so into it, they laughed so hard, and they cheered for spirit in the end. <br /><br />Enjoy ""Spirit"" with your family and have your spirit lifted with this heartwarming story. Your kids will love it. I think you will too.","यह एक अच्छी कहानी के साथ एक महान फिल्म थी । मेरे बच्चे (10, 7, 5, और 4) सब अपने आप सहित इस फिल्म, प्यार करता था । संगीत भी लाजवाब था. नहीं, घोड़ों की बात नहीं है, लेकिन बजाय, कहानी भावना से कहा जाता है । और एक कहानी सुनने के लिए एक घोड़े की बात से कहा कि अगर देखने के मजेदार था । < br/> < br/> मुझे लगता है कि शीर्षक यह सब कहते हैं, ""आत्मा"" । यह फिल्म वास्तव में आप परिवार और घर और दोस्तों की भावना देता है । मैं कहना है कि मेरे 4 साल पुराने लड़का और 5 साल की लड़की वास्तव में इस फिल्म से छुआ गया होता, और यहां तक कि यह इतना में मिला है, वे बहुत मुश्किल हंसे, और वे अंत में आत्मा के लिए खुशी हुई । < br/> < br/> अपने परिवार के साथ ""भावना"" का आनंद लें और अपनी आत्मा को इस दिली कहानी के साथ उठा लिया । अपने बच्चों को यह प्यार करेंगे । मुझे लगता है कि तुम भी होगा ।",9
"I really enjoyed this film because I have a tremendous interest in American History... the Antebellum years and the Civil War in particular. I purchased it recently from a rack of previously-viewed videos on sale at the supermarket and I was very glad to add this one to my history video collection. Though not of the caliber of Civil War films such as ""Glory"" or ""Gettysburg,"" provides a lot of history on the pre-Civil War brotherhood among cadets at West Point.<br /><br />Maybe it's the gray uniforms, the youth, or the military discipline, but I am fascinated by the story of the Corps of Cadets from around 1830 to the brink of the War. I imagine what it must have been like to sit in a classroom with other young men, learning how to make war, then later putting the lessons to use against your own classmates!<br /><br />Actually, there were two classes graduated in 1861: one class in May, the other in June. the movie makes no real mention of this, except to mention Henry A. DuPont, first graduate of the May Class; and George Custer, last grad of the June Class. the reason for the two classes was not so much about the war, but it was the result of switching back to a four-year course of study, after a few years of experimenting with a five-year course (I think the first class had attended five years, the other for four). As the movie portrays, cadets were like brothers and often had nicknames for each other... George ""Fanny"" or ""Autie"" Custer; Alonzo ""Lon"" Cushing; James ""Beauty"" Stuart (for J.E.B. Stuart, class of 1854), etc.<br /><br />I say this film is ""Santa Fe Trail"" as it should have been because that 1940 film, while enjoyable, really fudges history. Cadets from several different classes are all graduating together. JEB Stuart and George Custer are portrayed as the best of friends and are side-by-side in stopping John Brown's 1859 insurrection at Harper's Ferry. In fact, Stuart and Custer were never friends, but enemies during the War. They faced each other (for the first time, I think) at Gettysburg in 1863 (Stuart was at the Harper's ferry Raid, but Custer was still a cadet at the Point when it took place).<br /><br />""Fanny"" Custer plays a role in ""Class of '61,"" though his classmate chums, Dev O'Neill and Shelby Peyton are fictional. I believe they are respectively based on Partick Henry O'Rorke and John Pelham, two people you can look up.<br /><br />Anyway, I truly enjoy this film or any film which provides a window into mid-19th Century America.","मैं वास्तव में इस फिल्म का आनंद लिया क्योंकि मैं अमेरिकी इतिहास में एक जबरदस्त रुचि है.. । Antebellum साल और विशेष रूप से सिविल युद्ध । मैं यह हाल ही में खरीदे सुपरमार्केट में बिक्री पर पहले से देखा वीडियो की एक रैक से और मैं बहुत मेरे इतिहास वीडियो संग्रह करने के लिए यह एक जोड़ने के लिए खुश था । हालांकि इस तरह के ""जय"" या ""गैटिसबर्ग,"" के रूप में नागरिक युद्ध फिल्मों की क्षमता का नहीं वेस्ट प्वाइंट पर कैडेटों के बीच पूर्व नागरिक युद्ध भाईचारे पर इतिहास का एक बहुत प्रदान करता है । < br/> < br/> शायद यह भूरे रंग की वर्दी, युवा, या सैंय अनुशासन है, लेकिन मैं द्वारा मोहित हूं १८३० के चारों ओर से युद्ध के कगार पर कैडेट्स के वाहिनी की कहानी । मैं सोचता हूं कि यह क्या हो गया है अंय युवा पुरुषों के साथ एक कक्षा में बैठने की तरह, कैसे युद्ध करने के लिए, तो बाद में सबक अपने सहपाठियों के खिलाफ उपयोग करने के लिए सीख रहा है! < br/> < br/> वास्तव में, वहां दो वर्गों १८६१ में स्नातक थे: मई में एक वर्ग , जून में दूसरे । फिल्म इस का कोई वास्तविक उल्लेख करता है, सिवाय हेनरी ए ड्यूपॉंट, मई वर्ग के पहले स्नातक का उल्लेख करने के लिए; और जॉर्ज कस्टर, जून वर्ग के अंतिम स्नातक । दो वर्गों के लिए कारण युद्ध के बारे में इतना नहीं था, लेकिन यह एक चार अध्ययन के वर्ष के पाठ्यक्रम के लिए वापस स्विचन का परिणाम था, एक पांच साल के पाठ्यक्रम के साथ प्रयोग करने के कुछ वर्षों के बाद (मुझे लगता है कि पहली कक्षा में भाग लिया था पांच साल , चार के लिए अंय) । फिल्म चित्रण के रूप में कैडेट भाइयों की तरह थे और अक्सर एक दूसरे के लिए उपनाम था... जॉर्ज ""फैनी"" या ""Autie"" कस्टर; Alonzo ""लोण"" कुशिंग; जेंस ""सौंदर्य"" स्टुअर्ट (J.E.B. स्टुअर्ट, १८५४ के वर्ग के लिए), आदि < br/> < br/> मैं कहना है कि इस फिल्म है ""सांता Fe निशान"" के रूप में यह होना चाहिए था क्योंकि कि १९४० फिल्म, जबकि सुखद, वास्तव में हेराफेरी इतिहास । कई विभिन्न वर्ग से कैडेट सभी एक साथ ग्रेजुएशन कर रहे हैं । JEB स्टुअर्ट और जॉर्ज कस्टर दोस्तों के सर्वश्रेष्ठ के रूप में चित्रित कर रहे है और साथ-साथ है हार्पर नौका में जॉन ब्राउन १८५९ विद्रोह रोक में । दरअसल, स्टुअर्ट और कस्टर कभी दोस्त नहीं थे, लेकिन युद्ध के दौरान दुश्मन थे । वे एक दूसरे का सामना करना पड़ा (पहली बार के लिए, मुझे लगता है कि) १८६३ में गैटिसबर्ग में (स्टुअर्ट है हार्पर नौका छापे में था, लेकिन कस्टर अभी भी बिंदु पर एक आल था जब यह जगह ले ली) । < br/> < br/> ""फैनी"" कस्टर ""६१ की कक्षा में एक भूमिका निभाता है,"" हालांकि अपने सहपाठी दोस्त , देव ओ ' नील और Shelby Peyton काल्पनिक हैं. मेरा मानना है कि वे क्रमशः Partick हेनरी O'Rorke और जॉन पेल्हम, दो लोगों को आप देख सकते है पर आधारित हैं । < br/> < br/> वैसे भी, मैं वास्तव में इस फिल्म या किसी भी फिल्म है जो मध्य 19 वीं सदी अमेरिका में एक खिड़की प्रदान करता है का आनंद लें ।",8
"""The Lion King"" is without a doubt my favorite Disney movie of all time, so I figured maybe I should give the sequels a chance and I did. Lion King 1 1/2 was pretty good and had it's good laughs and fun with Timon and Pumba. Only problem, I feel sometimes no explanations are needed because they can create plot holes and just the feeling of wanting your own explanation. Well, I would highly recommend this movie for lion King fans or just a night with the family. It's a fun flick with the same laughs and lovable characters as the first. So, hopefully, I'll get the same with the third installment to the Lion King series. Sit back and just think Hakuna Matata! It means no worries! <br /><br />8/10","""शेर राजा"" एक शक मेरे सभी समय का पसंदीदा डिज्नी फिल्म के बिना है, तो मुझे लगा शायद मैं अगली कड़ी एक मौका देना चाहिए और मैंने किया । शेर राजा 1 1/2 बहुत अच्छा था और यह अच्छा हंसते हुए कहते है और Timon और Pumba के साथ मज़ा है । केवल समस्या है, मैं कभी नहीं लगता है कोई स्पष्टीकरण की जरूरत है क्योंकि वे भूखंड छेद बना सकते है और सिर्फ अपने विवरण चाहने की भावना । खैर, मैं अत्यधिक शेर राजा प्रशंसकों या परिवार के साथ सिर्फ एक रात के लिए इस फिल्म की सिफारिश करेंगे । यह एक ही हंसते हुए कहते है और पहले के रूप में प्यारा अक्षर के साथ एक मजेदार झटका है । तो, उंमीद है, मैं शेर राजा श्रृंखला के लिए तीसरी किस्त के साथ ही मिल जाएगा । वापस बैठो और बस लगता है कि Hakuna Matata! यह कोई चिंता का मतलब है! < br/> < br/> 8/10",8
"""Gespenster"" Question of to be cool in the German cinema<br /><br />There are not many German films in the last ten years, who have made me so interest. Yes, the problem of the most German films are in this film ""Gespenster"" too. He is on some places to uncooked to be good to see. Special the figure of Toni (Sabine Timento) is too cool. But thats is in German films always so. Everybody must to learns this coolneß - is the realism in this films. Thats difficult to understand. But in this case it makes some sense, because she steals and she lies - she is the kind of girl is better you never love it, because you lose it. Thats not clear for the other girl Nina in this film. She love her - and she would lose her. But Nina lost everything. She will play with soft emotion and a sad feeling. There is no way - but you must take it said Herbert Achterbusch for twenty years. Thats so often the way it goes in German films. Why? Nina (Julia Hummer) is not inside of the laws of society - the is outside - and there she have no chance. This films tries not on every place to gave her a part inside. Thats one of the problems - the stupid break with conventions - the criminal fascination. Throw it all away - and go nowhere! But the actress plays this difficult part very interesting. On the other side - there the parents - who are the pendant to the two girls. The have a car - a hotel suite - the have money and live in world with music of the opera. But the film stand always in some distance to seem. There is no much explaining of them.<br /><br />In the center of this film, there is one scene you will never forget. The two girls got to a casting. And there they should say how they find together. In this scene Toni will lying on. She said a fantastic story-has nothing to do with her. And then Nina will say the truth. She said it in an introversion way. There is no exhibition in it. She looks to the bottom and said what will happened for here. Thats a great moment. In the next scene on the party with pictures in red this feeling is going on- than Toni goes away...<br /><br />Okay, The film will end - in the German way of coolneß - rubbish - here the circle of sadness is closing. But there was a moment - where is happening something else - and this moment was important. He is more than German coolneß - and this moments are rare in the German cinema in this time!","जर्मन सिनेमा में कूल होने का ""Gespenster"" प्रश्न < br/> < br/> पिछले दस साल में कई जर्मन फिल्में नहीं हैं, जिन्होंने मुझे इतना इंटरेस्ट दिया है । जी हां, सबसे ज्यादा जर्मन फिल्मों की समस्या इस फिल्म ""Gespenster"" में भी है । वह कुछ स्थानों पर है जो देखने में अच्छा नहीं धोते हैं । विशेष टोनी (सबीन Timento) का आंकड़ा भी ठंडा है । लेकिन है कि जर्मन फिल्मों में हमेशा ऐसा है । हर किसी को इस coolneß को सीखना चाहिए-इस फिल्मों में यथार्थवाद है । thats समझने में मुश्किल है । लेकिन इस मामले में यह कुछ समझ में आता है, क्योंकि वह चोरी और वह झूठ है-वह लड़की की तरह बेहतर है कि तुम इसे प्यार कभी नहीं है, क्योंकि तुम इसे खो देते हैं । thats इस फिल्म में दूसरी लड़की नीना के लिए स्पष्ट नहीं है । वह उसे प्यार करता हूं और वह उसे खोना होगा । लेकिन नीना ने सब कुछ खो दिया । वह नरम भावना और एक दुखद भावना के साथ खेलेंगे । वहां कोई रास्ता नहीं है-लेकिन आप इसे ले जाना चाहिए बीस साल के लिए हर्बर्ट Achterbusch कहा । thats तो अक्सर जिस तरह से यह जर्मन फिल्मों में चला जाता है । क्यों? नीना (जूलिया हथौड़ा) समाज के कानूनों के अंदर नहीं है-बाहर है-और वहां वह कोई मौका नहीं है । यह फिल्मों हर जगह पर नहीं की कोशिश करता है उसे एक हिस्सा अंदर दिया । समस्याओं में से एक thats-संमेलनों के साथ बेवकूफ तोड़-आपराधिक आकर्षण । यह सब दूर फेंक-और कहीं नहीं जाना! लेकिन अभिनेत्री इस मुश्किल हिस्सा बहुत दिलचस्प निभाता है । दूसरी तरफ-वहां माता-पिता-जो दो लड़कियों के लिए लटकने वाले हैं. एक कार है-एक होटल के सुइट-पैसा है और ओपेरा के संगीत के साथ दुनिया में रहते हैं । लेकिन फिल्म में हमेशा कुछ दूरी पर खड़े दिखते हैं. उनमें से कोई बहुत समझा नहीं है । < br/> < br/> इस फिल्म के केंद्र में एक ऐसा सीन है जिसे आप कभी नहीं भूल पाएंगे । दोनों लड़कियों को एक कास्टिंग के लिए मिला है । और वहां वे कहना चाहिए कि वे कैसे एक साथ मिल । इस दृश्य में टोनी पर झूठ बोल रही होगी । उसने कहा कि एक शानदार कहानी-उसके साथ कुछ नहीं करना है । और फिर नीना सच कह देगी. उसने कहा कि यह एक introversion तरीके से । इसमें कोई प्रदर्शनी नहीं है । वह नीचे से दिखता है और कहा कि यहां के लिए क्या हुआ होगा । thats एक महान क्षण । लाल रंग में चित्रों के साथ पार्टी पर अगले दृश्य में यह महसूस हो रहा है-से टोनी दूर हो जाता है... < br/> < br/> ठीक है, फिल्म खत्म हो जाएगी-जर्मन रास्ते में coolneß-बकवास-यहाँ उदासी का गोला बंद हो रहा है. लेकिन एक क्षण था-जहां कुछ और हो रहा है-और यह क्षण महत्वपूर्ण था । वह जर्मन coolneß से अधिक है-और इस समय में जर्मन सिनेमा में दुर्लभ हैं!",8
'Cry Freedom' is a movie about how far people will go to find the truth.<br /><br />The first half is an interesting portrayal of an unlikely friendship between activist Steve Biko and Editor Don Woods (played fanatically by Dezel Washington and Kevin Klein). While the second half deals with Woods looking for answers on Biko's death.<br /><br />Although most people favor the first half of the movie which focuses on the unlikely friendship between Biko and Woods'. I found the second half about Don woods struggle to have Biko's story be heard around the world much more interesting.,' रोना आजादी ' के बारे में एक फिल्म कितनी दूर तक लोगों के लिए सच खोजने के लिए जाना होगा । < br/> < br/> पहली छमाही कार्यकर्ता स्टीव बाईको और संपादक डॉन वुड्स के बीच एक नापसंद दोस्ती का एक दिलचस्प चित्रण है (Dezel वाशिंगटन और केविन क्लेन द्वारा कट्टरपंथी निभाई) । जबकि वुड्स के साथ दूसरी छमाही सौदों बाईको की मौत पर जवाब के लिए देख रहे हैं । < br/> < br/> हालांकि ज्यादातर लोग फिल्म की पहली छमाही जो बाईको और ' वुड्स के बीच दोस्ती की संभावना पर केंद्रित है एहसान ' । मैं डॉन वुड्स संघर्ष के बारे में दूसरी छमाही पाया है बाईको कहानी दुनिया भर में सुना है और अधिक दिलचस्प है ।,8
