"Midnight Cowboy is not for everybody. It's raw, painful, and realistic but very entertaining. The lead actors Jon Voight and Dustin Hoffman who would go on to become Oscar winning actors deliver amazing performances. Voight as the Texas hustler, Joe Buck, who migrates from small town Texas to New York City to become a hustler. He does not apologize for his chosen profession but it is not that easy. The New York City women like the rich lady played by Georgeann Johnson and Cass played by Oscar nominated Sylvia Miles are different than Texas women. Sadly, Buck is trying to escape from his past life in Texas. He was raised by his grandmother, Sally Buck, played by the wonderful actress Ruth White who died in 1969 from cancer. The locations in New York City are wonderful to watch as is the relationship between Fatso played by Hoffman and Buck's characters evolve into a moving male to male friendship. The men are struggling to survive the New York City life by not playing by the rules like getting a real job. As the film evolves, Buck's past comes to the surface and it's haunting but not clear. The film is not for children but compared to today's films and television programming, Midnight Cowboy might be more tame. I can't forget a young Brenda Vaccaro and a party that you can't forget. It's also a tearjerker of a film, so get your hankies out too.","आधी रात चरवाहा सबके लिए नहीं है । यह कच्चे, दर्दनाक, और यथार्थवादी लेकिन बहुत मनोरंजक है । नेतृत्व अभिनेताओं जॉन वॉइट और डस्टिन हॉफमैन जो ऑस्कर जीतने के अभिनेताओं बनने पर जाना होगा अद्भुत प्रदर्शन उद्धार । वॉइट के रूप में टेक्सास पोर्न, जो बक, जो छोटे शहर टेक्सास से ंयूयॉर्क शहर में प्रवास के लिए एक पोर्न बन जाते हैं । वह अपने चुने हुए पेशे के लिए माफी नहीं मांगता लेकिन यह इतना आसान नहीं है । अमीर महिला Georgeann जॉनसन और Cass द्वारा निभाई की तरह ंयूयॉर्क शहर महिलाओं ऑस्कर नामांकित सिल्विया मील की दूरी पर टेक्सास महिलाओं से अलग है द्वारा निभाई गई । अफसोस की बात है, बक टेक्सास में अपने पिछले जीवन से बचने की कोशिश कर रहा है । वह अपनी दादी, सैली बक, अद्भुत अभिनेत्री रूथ व्हाइट जो कैंसर से १९६९ में मृत्यु द्वारा निभाई द्वारा उठाया गया था । ंयूयॉर्क शहर में स्थानों को देखने के रूप में Fatso हॉफमैन और बक के पात्रों द्वारा निभाई पुरुष दोस्ती के लिए एक चलती पुरुष में विकसित के बीच संबंध है अद्भुत हैं । पुरुषों के लिए एक असली काम हो रही तरह नियमों से नहीं खेल से ंयूयॉर्क शहर के जीवन को जीवित रहने के लिए संघर्ष कर रहे हैं । के रूप में फिल्म विकसित, बक अतीत की सतह पर आता है और यह सता रहा है लेकिन स्पष्ट नहीं है । फिल्म बच्चों के लिए नहीं है, लेकिन आज की फिल्मों और टीवी प्रोग्रामिंग की तुलना में, आधी रात चरवाहे और अधिक वश में हो सकता है । मैं एक युवा बे्रंडा Vaccaro और एक पार्टी है कि आप भूल नहीं सकते भूल नहीं कर सकते । यह भी एक फिल्म का एक tearjerker है, तो अपने को बाहर भी हांक जाओ ।",10
This is a must see for anybody who loves thriller's specially political thriller. One scene that stands out is Milgram experiment it is shot to perfection very rarely do we get to see a movie shot and scripted the way this movie is presented.<br /><br />The movie starts with a Kennedy like assassination and a three member team is constituted to investigate the assassination. However one of the member does not agree with the final findings of the committee. As per the terms set that member would initiate a one man investigation into the assassination. This investigation gets him involved in into to deep and dark secrets of high office politics and the way they are controlled.,"यह किसी को भी, जो थ्रिलर विशेष रूप से राजनीतिक थ्रिलर प्यार करता है के लिए देखना चाहिए । एक दृश्य है कि बाहर खड़ा है Milgram प्रयोग यह पूर्णता के लिए गोली मार दी है बहुत कम ही हम एक फिल्म शॉट देखने के लिए और जिस तरह से इस फिल्म प्रस्तुत किया जाता है पटकथा हो । < br/> < br/> फिल्म हत्या की तरह एक कैनेडी के साथ शुरू होता है और एक तीन सदस्यीय टीम के लिए गठित है हत्या की जांच चल रही है । हालांकि सदस्य में से एक समिति के अंतिम निष्कर्षों से सहमत नहीं है । शर्तों के अनुसार निर्धारित है कि सदस्य हत्या में एक आदमी की जांच शुरू होगा । इस जांच में उसे उच्च पद की राजनीति और जिस तरह से वे नियंत्रित कर रहे है के गहरे और अंधेरे रहस्यों को में शामिल हो जाता है ।",10
"Delightful film directed by some of the best directors in the industry today. The film is also casting some of the great actors of our time, not just from France but from everywhere.<br /><br />My favorite segments:<br /><br />14th arrondissement: Carol (Margo Martindale), from Denver, comes to Paris to learn French and also to make a sense of her life.<br /><br />Montmartre: there was probably not a better way to start this movie than with this segment on romantic Paris.<br /><br />Loin du 16ème: an image of Paris that we are better aware of since the riots in the Cités. Ana (Catalina Sandino Moreno) spends more time taking care of somebody else's kid (she's a nanny) than of her own.<br /><br />Quartier Latin: so much fun to see Gérard Depardieu as the ""tenancier de bar"" with Gena Rowlands and Ben Gazzara discussing their divorce.<br /><br />Tour Eiffel: don't tell me you didn't like those mimes!<br /><br />Tuileries: such a treat to see Steve Buscemi as the tourist who's making high-contact (a no- no) with a girl in the Metro.<br /><br />Parc Monceau: Nick Nolte is great. Ludivine Sagnier also.<br /><br />I've spend 3 days in Paris in 2004 and this movie makes me want to go back!<br /><br />Seen in Barcelona (another great city), at the Verdi, on March 18th, 2007.<br /><br />84/100 (***)","रमणीय फिल्म उद्योग में कुछ सर्वश्रेष्ठ निर्देशकों द्वारा निर्देशित आज । फिल्म हमारे समय के कुछ महान अभिनेताओं की कास्टिंग भी है, न सिर्फ फ्रांस से बल्कि हर जगह से । < br/> < br/> मेरा पसंदीदा सेगमेंट: < br/> < br/> 14th arrondissement: कैरोल (मार्गो Martindale), डेनवर से, फ्रेंच जानने के लिए पेरिस के लिए आता है और यह भी की भावना बनाने के लिए उसके जीवन । < br/> < br/> Montmartre: वहां रोमांटिक पेरिस पर इस खंड के साथ तुलना में इस फिल्म शुरू करने के लिए एक बेहतर तरीका शायद नहीं था । < br/> < br/> कमर du 16ème: पेरिस की एक छवि है कि हम Cités में दंगों के बाद से बेहतर जानते हैं । एना (Catalina Sandino मोरेनो) और अधिक समय किसी और बच्चे की देखभाल ले खर्च करता है (वह एक नानी है) अपने से । < br/> < br/> Quartier लैटिन: इतना मज़ा Gena Rowlands और बेन Gazzara उनके तलाक पर चर्चा के साथ ""tenancier de bar"" के रूप में जेरार्ड Depardieu देखने के लिए । < br/ > < br/> टूर एफिल: मुझे बताओ न आप उन mimes पसंद नहीं था! < br/> < br/> Tuileries: इस तरह के एक इलाज के लिए पर्यटक कौन बना रहा है के रूप में स्टीव Buscemi देखने मेट्रो में एक लड़की के साथ उच्च संपर्क (कोई नहीं) । < br/> < br/> Parc Monceau: निक Nolte ग्रेट आहे. Ludivine Sagnier भी. < br/> < br/> मैं २००४ में पेरिस में 3 दिन बिताने और इस फिल्म बनाता है मुझे वापस जाना चाहते हैं! < br/> < br/> बार्सिलोना में देखा (एक और महान शहर), मार्च को Verdi में, 18 वीं, 2007. < br/> < br/> 84/100 (* * *)",8
"The most important thing about this movie is the brilliant performance by Daniel Day-Lewis and Hugh O'Conor as Christy Brown, guineas artist and fighter who despite of her physical condition overcame all the odds. As a person who did work with patients with cerebral palsy, I can assure you that their performance were shockingly convincing. The enormous support that Christy got form his family, low-income, working class Dubliners, encouraged him to do the impossible and this picture depicted this support brilliantly have not read the book, but the dialogs were written wisely to capture Christy Brown's witty arrogant personality. I do recommend this movie to everyone, especially to classic movie-lovers.","इस फिल्म के बारे में सबसे महत्वपूर्ण बात डैनियल दिवस द्वारा शानदार प्रदर्शन-लुईस और क्रिस्टी ब्राउन, गिनीज़ कलाकार और सेनानी के रूप में ह्यूग O'Conor है जो उसके शारीरिक हालत overcame सभी बाधाओं के बावजूद । एक व्यक्ति जो मस्तिष्क पक्षाघात के साथ रोगियों के साथ काम किया है के रूप में, मैं आपको विश्वास दिलाता हूं कि उनके प्रदर्शन को घिनौना कायल थे । भारी समर्थन है कि क्रिस्टी अपने परिवार के फार्म मिला, कम आय, श्रेणी के डबलिन काम कर रहे, उसे प्रोत्साहित करने के लिए असंभव है और इस तस्वीर को इस समर्थन चित्रित किया शानदार किताब नहीं पढ़ी है, लेकिन संवाद बुद्धिमानी से लिखा गया था पर कब्जा करने के लिए क्रिस्टी ब्राउन मजाकिया अभिमानी व्यक्तित्व । मैं हर किसी के लिए इस फिल्म की सिफारिश करते हैं, विशेष रूप से क्लासिक फिल्म प्रेमियों के लिए ।",9
"I would almost give it 10 out of 10. However, there are some confusing parts as well as sections that are miss-leading which hurt the flow/continuity of the film. The story line is great and well composed; you will definitely want to watch this quietly to fully understand it. The characters are complicated and so is the story line, expect to be given only enough information to stop scratching your head, it's a film where all is explained in the end. The animation is great and the combination of femme fatal and film noir result in a great film that is unlike anything else I've seen in animation. It is a black and white film and its quiet dark in a few scenes so it's worth watching it on a good T.V, or plasma. The character voices do save this film in its English version, but it would have been more convincing if there were some French accents to emphasize that its happening Paris, I enjoyed it more in French with English subtitles. One the whole its well worth buying on DVD or BlueRay if they have it! And personally if you enjoyed this film you might also like; Waking Life & Ghost in a Shell 2 Innocence, this is just a personal suggestion.","मैं लगभग 10 से बाहर 10 दे देंगे । हालांकि, वहां कुछ भ्रमित भागों के रूप में के रूप में अच्छी तरह से वर्गों है कि याद कर रहे है अग्रणी जो प्रवाह को चोट/ कहानी लाइन महान और अच्छी तरह से बना है; आप निश्चित रूप से यह चुपचाप देखने के लिए पूरी तरह से इसे समझने के लिए चाहते हैं । अक्षर और जटिल है तो कहानी लाइन है, केवल पर्याप्त जानकारी के लिए अपने सिर scratching बंद कर दिया होने की उंमीद है, यह एक फिल्म है जहां सभी अंत में समझाया है । एनीमेशन महान और femme घातक और फिल्म के संयोजन के एक महान फिल्म है कि कुछ और मैं एनीमेशन में देखा है के विपरीत है में शिद्दत परिणाम है । यह एक काले और सफेद फिल्म है और कुछ दृश्यों में अपने शांत अंधेरे तो यह एक अच्छा टी. वी, या प्लाज्मा पर देखने के लायक है । चरित्र आवाज अपने अंग्रेजी संस्करण में इस फिल्म को बचाने के लिए करते हैं, लेकिन यह गया है और अधिक कायल अगर वहां कुछ फ्रांसीसी लहजे को जोर है कि अपने पेरिस हो रहा था, मैं इसे और अधिक फ्रेंच में अंग्रेजी उपशीर्षक के साथ मज़ा आया । एक डीवीडी या BlueRay पर अपनी अच्छी तरह से मूल्य खरीद अगर वे यह है! और व्यक्तिगत रूप से यदि आप इस फिल्म का आनंद लिया तुम भी पसंद है; जागते जीवन & भूत एक शैल 2 मासूमियत में, यह सिर्फ एक निजी सुझाव है ।",9
"If your idea of a thriller is car chases, explosions, and dozens of people being mowed down by gunfire, then ""House of Games"" is definitely not the movie for you. If you like and appreciate psychological drama and suspense, then, by all means, see it.<br /><br />""House of Games"" tells the story of an esteemed psychologist and writer, Dr. Margaret Ford (Lindsay Crouse), who tries to help a patient and gets involved in the shadowy world of con men led by the charismatic Mike (Joe Mantegna). To say anything more about the plot would ruin the suspense. Frankly, I find it hard to believe anyone who says they saw the twists coming. Just like a clever con artist, this movie draws you into its web and lulls your vigilance.<br /><br />The story is taut and well-crafted, the dialogue smart and laconic, the acting uniformly good (Mantegna is superbly charismatic). Some have complained that Dr. Ford is not a very sympathetic character, and wondered why Mamet would make Lindsay Crouse look so physically unattractive. But Dr. Ford is supposed to be cold and aloof; moreover, her homeliness is in a way essential to the plot (at one point, I believe that an injury to her sexual self-esteem is a key part of her motivation ... I'll say no more).<br /><br />""House of Games"" is a dark look at the underside of human nature that concludes on a note of discomforting ambiguity. It will hold your attention every second while you are watching, and stay with you for a long time afterwards.","यदि एक थ्रिलर के अपने विचार कार का पीछा, विस्फोट, और लोगों के दर्जनों गोलियों द्वारा नीचे रौंद जा रहा है, तो ""खेल के घर"" निश्चित रूप से आप के लिए फिल्म नहीं है । यदि आप की तरह है और मनोवैज्ञानिक नाटक और रहस्य की सराहना करते हैं, फिर, हर तरह से, यह देखते हैं । < br/> < br/> ""हाउस ऑफ गेम्स"" एक संमानित मनोवैज्ञानिक और लेखक की कहानी कहता है, डॉ मार्गरेट फोर्ड (लिंडसे Crouse), जो एक मरीज की मदद करने की कोशिश करता है और हो जाता है में शामिल है छायांकन कांग्रेस के करिश्माई माइक (जो Mantegna) के नेतृत्व में पुरुषों की दुनिया । साजिश के बारे में अधिक कुछ भी कहना रहस्य को बर्बाद कर देगा । सच कहूं तो, मैं इसे किसी को भी, जो कहते है कि वे आ twists देखा मुश्किल लगता है । बस एक चतुर चोर कलाकार की तरह, यह फिल्म आप अपने वेब में खींचता है और अपनी सतर्कता खामोशी । < br/> < br/> कहानी तना हुआ है और अच्छी तरह से तैयार है, संवाद स्मार्ट और laconic, अभिनय समान रूप से अच्छा है (Mantegna शानदार करिश्माई है) । कुछ ने शिकायत की है कि डॉ फोर्ड एक बहुत सहानुभूति चरित्र नहीं है, और सोचा क्यों मामेट लिंडसे Crouse बनाना होगा तो शारीरिक रूप से बदसूरत लग रही हो । लेकिन डॉ फोर्ड को ठंडा और अलग माना जाता है; इसके अलावा, उसे homeliness एक भूखंड के लिए आवश्यक रास्ते में है (एक बिंदु पर, मुझे विश्वास है कि उसे यौन आत्मसंमान के लिए एक चोट उसकी प्रेरणा का एक महत्वपूर्ण हिस्सा है.. । मैं और कोई नहीं कहूंगा) । < br/> < br/> ""हाउस ऑफ गेम्स"" मानव स्वभाव है कि असुविधा अस्पष्टता के एक नोट पर समाप्त के नीचे एक अंधेरे देखो । यह हर दूसरे जब आप देख रहे है आपका ध्यान रखना होगा, और एक लंबे समय बाद के लिए आप के साथ रहते हैं ।",8
