"An absurdly hilarious and strikingly human tale of the jealousies and infidelities surrounding a beetle marriage, Russian animation pioneer Wladyslaw Starewicz's ""Mest kinematograficheskogo operatora"" (""The Cameraman's Revenge"", or ""The Revenge of a Kinematograph Cameraman"") is a delight of early animation, brimming with highly-effective stop-motion puppetry and no shortage of imagination.<br /><br />Mr. and Mrs. Beetle have a completely uneventful marriage, and both yearn for more excitement in their lives. Mr. Beetle's desires can only be satisfied by the beautiful exotic dancer at the ""Gay Dragonfly"" night club, whom he visits whenever he takes a ""business trip"" to the city. She is the only one who understands him. A fellow admirer of this dancer, an aggressive grasshopper, is jealous that Mr. Beetle has stolen his lady and, as fate would have it, he is also a movie cameraman. The devious grasshopper follows Mr. Beetle and his acquaintance to a hotel room, where he films their exploits through the keyhole.<br /><br />Meanwhile, Mrs. Beetle has, likewise, acquired a friend to add excitement to her life. He is an artist, and he brings her a painting for a present, before they both settle down on the couch for some intimacy. At that moment, however, Mr. Beetle returns home and witnesses the entire spectacle. As Mr. Beetle bashes through the front door, the artist friend clambers up the chimney, but he doesn't escape without Mr. Beetle first venting his anger and frustration upon him.<br /><br />There is a certain irony in the statement that follows: ""Mr. Beetle is generous. He forgives his wife and takes her to a movie."" He is generous enough to forgive her, and yet he had been equally unfaithful just minutes earlier. At this point in time, however, we still haven't forgotten the jealous movie cameraman who had been plotting his revenge, and it is no surprise when he turns out to be the projectionist for the film Mr. and Mrs. Beetle are attending. Suddenly intercut into the film they are enjoying is the footage of Mr. Beetle's disloyalty, and the angry wife hits him across the head with an umbrella, before the frightened and angry husband dives through the theatre screen in search of the grasshopper.<br /><br />In the final scene, both Mr. and Mrs. Beetle, now somewhat more appreciative of each other, are serving time in prison for the fire that broke out when Mr. Beetle sought his final revenge. We do, indeed, hope that ""the home life of the Beetles will be less exciting in the future"" This film may appear to be a mere story of the comings-and-goings of a miniscule insect species, but Starewicz is communicating so much more than that. This isn't a story about beetles  it is a story about us. And it's startlingly accurate, isn't it?!","एक अजीब उल्लसित और ईर्ष्या और एक बीटल शादी आसपास के काफिरों के हड़ताली मानव कथा, रूसी एनीमेशन पायनियर Wladyslaw Starewicz के ""Mest kinematograficheskogo operatora"" (""कैमरामैन बदला"", या ""एक का बदला Kinematograph कैमरामैन "") जल्दी एनीमेशन, अत्यधिक प्रभावी रोकने के प्रस्ताव कठपुतली और कल्पना की कोई कमी नहीं है के साथ भरी की एक खुशी है । < br/> < br/> श्री और श्रीमती बीटल एक पूरी तरह से अनजाना शादी है, और दोनों में अधिक उत्तेजना के लिए तरस उनके जीवन. श्री बीटल इच्छाओं केवल ""समलैंगिक Dragonfly"" नाइट क्लब, जिसे वह जब भी वह शहर में एक ' व्यापार यात्रा ' लेता है पर सुंदर विदेशी नर्तकी द्वारा संतुष्ट किया जा सकता है । वह तो उसे ही समझता है । इस नर्तकी के एक साथी प्रशंसक, एक आक्रामक टिड्डी, ईर्ष्या है कि श्री बीटल अपनी महिला चोरी हो गया है और, के रूप में भाग्य यह होगा, वह भी एक फिल्म कैमरामैन है । कुटिल टिड्डी एक होटल के कमरे में श्री बीटल और अपने परिचित के बाद, जहां वह फिल्मों कीहोल के माध्यम से अपने कारनामों । < br/> < br/> इस बीच, श्रीमती बीटल है, इसी तरह, एक दोस्त को अपने जीवन के लिए उत्तेजना जोड़ने का अधिग्रहण किया । वह एक कलाकार है, और वह उसे एक वर्तमान के लिए एक चित्र लाता है, इससे पहले कि वे दोनों सोफे पर कुछ अंतरंगता के लिए नीचे बसा । उस पल में, लेकिन, श्री बीटल घर रिटर्न और पूरे तमाशा गवाहों । के रूप में श्री बीटल सामने दरवाजे के माध्यम से कोसने, कलाकार दोस्त चिमनी ऊपर clambers, लेकिन वह श्री बीटल के बिना नहीं बच पहले उसके गुस्से और हताशा पर निकाल रहा है । < br/> < br/> वहाँ बयान में एक निश्चित विडंबना है कि इस प्रकार है: ""श्री बीटल उदार है . वह अपनी पत्नी को क्षमा करता है और उसे एक फिल्म के लिए ले जाता है. "" वह काफी उदार है उसे माफ कर दो, और अभी तक वह समान रूप से उखड़े थे बस मिनट पहले । समय में इस बिंदु पर, तथापि, हम अभी भी ईर्ष्या फिल्म कैमरामैन जो उसका बदला लेने की साजिश रच रहा था भूल नहीं किया है, और यह कोई आश्चर्य की बात है जब वह बाहर जाता है फिल्म के लिए प्रक्षेपणक श्री और श्रीमती बीटल भाग ले रहे हैं । अचानक फिल्म में intercut वे आनंद ले रहे है श्री बीटल देशद्रोह के फुटेज है, और गुस्सा पत्नी उसे सिर भर में एक छाता के साथ हिट, इससे पहले कि भयभीत और गुस्से में पति टिड्डी की खोज में थिएटर स्क्रीन के माध्यम से गोते । < br/> < br/> अंतिम दृश्य में, दोनों श्री और श्रीमती बीटल, अब कुछ हद तक एक दूसरे के अधिक सराहना, आग है कि बाहर तोड़ दिया जब श्री बीटल अपने अंतिम बदला लेने की मांग के लिए जेल में समय की सेवा कर रहे हैं । हम करते हैं, वास्तव में, आशा है कि ""भृंग के घर जीवन भविष्य में कम रोमांचक हो जाएगा"" इस फिल्म के लिए एक miniscule कीट प्रजातियों के आने-जाने वालों की एक मात्र कहानी प्रकट हो सकता है, लेकिन Starewicz इतना है कि अधिक से अधिक संवाद है । यह भृंग के बारे में एक कहानी नहीं है यह हमारे बारे में एक कहानी है । और यह चौंकाने वाला सही है, है ना?!",8
"******* SPOILER! ********<br /><br />i saw this gr8 film a few years back, its a lovely story about a young fella who wants to drink his mothers milk at the breast but she thinks he is to old for it. he ends up lusting after another ladies breasts and ends up in competition with his brother who fancies her. throw in a jealous husband of this woman who cannot get ""aroused"" and you have a cheeky yet warm story about love, friendship and lovely pairs of jugs hehe<br /><br />its brilliant<br /><br />dont be put off by sub-tit-les hehe!","बिगाड़ने! < br/> < br/> मैं इस gr8 फिल्म कुछ साल पहले देखा था, यह एक युवा दोस्त है जो स्तन पर उसकी मां दूध पीना चाहता है के बारे में एक सुंदर कहानी है, लेकिन वह सोचता है कि वह इसके लिए पुराने है । वह एक और देवियों स्तनों के बाद वासना समाप्त होता है और अपने भाई के साथ प्रतिस्पर्धा में समाप्त होता है जो उसे काल्पनिक । इस औरत जो ""जगाया"" नहीं मिल सकता है और तुम प्यार के बारे में एक निर्लज्ज अभी तक गर्म कहानी है की जलन पति में फेंक, दोस्ती और कटोरे के सुंदर जोड़े hehe < br/> < br/> इसका शानदार < br/> < br/> उप-चूची-les hehe से दूर मत रखो!",8
"This show was great, it wasn't just for kids which I thought at first, it is for the whole family.<br /><br />The first season was mostly about the father looking after is two daughters and son, he sadly passed away in season 2, I Could believe it when I heard it.<br /><br />I am clad they carried on with the show as that what would really happen in really life and I need to mention The Goodbye Episode it was so well made, it must of be so hard for them to film this , you could tell they were real tears in theirs eyes. I am 24 year old male and this episode did make me cry me as I know how they felt as my father died when I was 13 years too just like Roy.<br /><br />Season 2 and Season 3 had great comedy in there also season 3 had some of my Favorites such Freaky Friday, Secrets.<br /><br />I Still think the show was Strong enough to go on, I was disappointed that it ended, it was one the best no it was the best Family comedy show ever since Home Improvement and it could have been the next Friends.<br /><br />it should never have ended but still love watching the repeats everyday.","इस शो महान था, यह सिर्फ बच्चों को जो मैंने सोचा के लिए नहीं था पहले, यह पूरे परिवार के लिए है । < br/> < br/> पहले सीजन के बारे में ज्यादातर देख रहे पिता के बारे में दो बेटियां और बेटा है, वह दुख की बात 2 सीजन में निधन हो गया है, मैं यह विश्वास है जब मैं इसे सुना सकता है । < br/> < br/ > मैं ढंकी हूं वे के रूप में है कि वास्तव में वास्तव में जीवन में क्या होगा और मैं अलविदा प्रकरण यह इतनी अच्छी तरह से बनाया गया था उल्लेख की जरूरत के साथ इस शो के साथ किया जाता है, तो होना चाहिए के लिए उंहें इस फिल्म के लिए मुश्किल है, तो आप बता सकते है वे उनकी आंखों में असली आंसू थे । मैं 24 वर्षीय पुरुष हूं और इस प्रकरण ने मुझे रो कर के रूप में मुझे पता है कि वे कैसे मेरे पिता की मृत्यु के रूप में महसूस किया जब मैं 13 साल का था भी बस रॉय की तरह । < br/> < br/> सीजन 2 और सीजन 3 में बड़ी कॉमेडी थी वहां भी सीजन 3 मेरे पसंदीदा में से कुछ ऐसा अजीब था शुक्रवार, राज. < br/> < br/> मुझे अब भी लगता है कि शो काफी मजबूत था पर जाने के लिए, मैं निराश हो गया था कि यह खत्म हो गया, यह सबसे अच्छा कोई यह सबसे अच्छा परिवार कॉमेडी कभी घर सुधार के बाद से दिखा रहा था और यह अगले दोस्त हो सकता था । < br/> < br/> यह कभी खत्म नहीं होना चाहिए एड लेकिन फिर भी हर रोज दोहराता देख प्यार करता हूं ।",10
This is one of the best of the genre. I saw it twice about 25yrs ago and have not had another opportunity to see it again since then. It rivals the Zatoichi series (also starring Katsu) in exciting swordplay.,यह शैली का सबसे अच्छा में से एक है । मैं इसे दो बार 25वर्ष पहले के बारे में देखा था और एक और इसे फिर से फिर से देखने का अवसर नहीं था । यह Zatoichi श्रृंखला प्रतिद्वंद्वियों (भी Katsu अभिनीत) रोमांचक तलवार में ।,8
This unpretentious Horror film is probably destined to become a cult classic. Much much better than 90% of the Scream rip-offs out there! I even hope they come up with a sequel!,यह कपटी हॉरर फिल्म शायद एक पंथ क्लासिक बनने के लिए किस्मत में है । बहुत चीख चीर के ९०% से बेहतर वहां नापसंद! मैं भी उंमीद है कि वे एक अगली कड़ी के साथ आया!,9
"Finally got to see this classic TV movie on an unofficial disc recorded from an old VHS, it is a classic piece of horror. Its a pity more of this neglected corner of horror in terms of official releases on DVD and VHS ... the TV horror movie. Recommended for all fans of the 70's TV movie much like trilogy of terror. Those interested should get the book on the subject by David Deal - Television Fright Films of the 70's. Email me for a chance to see it.....its fabulous to see it again.<br /><br />It does have it problems like many TV movies they have to be rather inventive in the effects dept and even at 70 mins it can seem to drag possibly we are all used to more modern editing but still great stuff and far better than many theatrical frights released today.","अंत में एक अनौपचारिक एक पुराने वीएचएस से दर्ज डिस्क पर इस क्लासिक टीवी फिल्म देखने को मिला, यह डरावना का एक क्लासिक टुकड़ा है । इसकी एक दया और वीएचएस पर सरकारी विज्ञप्ति के मामले में आतंक के इस उपेक्षित कोने के अधिक.. । बहुत आतंक की त्रयी की तरह है 70 टीवी फिल्म के सभी प्रशंसकों के लिए सिफारिश की । उन दिलचस्पी डेविड डील द्वारा विषय पर किताब मिलना चाहिए-टेलीविजन डर फिल्मों के 70 है । मुझे यह देखने का मौका के लिए ईमेल... । इसकी शानदार इसे फिर से देखने के लिए । < br/> < br/> यह कई टीवी फिल्मों वे प्रभाव विभाग में बल्कि अंवेषक बनने के लिए है और यहां तक कि ७० मिनट में यह संभवतः हम सब और अधिक आधुनिक संपादन के लिए इस्तेमाल कर रहे है खींचें प्रतीत हो सकता है की तरह समस्याओं है, लेकिन अभी भी महान सामान और अभी तक कई नाटकीय आज जारी भय से बेहतर है ।",7
"I was hooked from beginning to end. Great horror comes from disturbing imagery and organic shocks that are created not to make you jump, but to make you go ""What the f*ck did I just see?"" All the other commentators gave short summaries of what the film is about, so I won't rehash what has already been said. I was telling other people about this movie days after I had seen it just because it still haunted me. I even had a bad dream after seeing it, and I am a true horror fan, not easily spooked by tripe like ""The Grudge"" or even ""Silent Hill"". What gave me the bad dreams was the unease I felt about what I would do if I were in that cell with those guys. What would my personal horror be? my subconscious took me there, and it was not pleasant. That my friends is what a good horror flick does to you! The best part of this movie is that it is subtle. It's not about Bogeymen that jump out at you,alien invasions, or tons of gore. It's the opposite. The horror you create in your own mind. The irony for the four characters is that the horror comes not from an external force that asserts it's power over them. Simply, the men ask for the one thing they desire, and they get it...but not in the way they imagined. So on the one hand, they get what they wish for from an occult book, but may ultimately wish they hadn't. Sometimes being locked in a jail cell is the best place to be!","मैं शुरू से अंत तक झुका हुआ था । महान हॉरर परेशान कल्पना और कार्बनिक झटके है कि आप कूद बनाने के लिए नहीं बनाया जाता है से आता है, लेकिन आप जाने के लिए ""क्या एफ * ck मैं सिर्फ देख कर किया जाता है?"" सभी अंय टिप्पणीकारों क्या फिल्म के बारे में है की संक्षिप्त सारांश दिया, तो मैं नहीं होगा जो पहले से ही कहा गया है । मैं इस फिल्म के दिनों के बारे में अंय लोगों को कह रहा था के बाद मैं इसे देखा था सिर्फ इसलिए कि यह अभी भी मुझे सता । मैं भी इसे देखने के बाद एक बुरा सपना था, और मैं एक सच्चे डरावने प्रशंसक हूं, आसानी से ""शिकायत"" या यहां तक कि ""चुप हिल"" की तरह यात्रा से डरावना नहीं है । क्या मुझे बुरा सपने दिया था मैं अगर मैं उन लोगों के साथ उस सेल में थे क्या होगा के बारे में महसूस किया ढील । मेरे निजी हॉरर क्या होगा? मेरे अवचेतन मुझे वहां ले गया, और यह सुखद नहीं था । कि मेरे दोस्त है जो एक अच्छा हॉरर झटका आप के लिए करता है! इस फिल्म की सबसे अच्छी बात यह है कि यह सूक्ष्म है । यह Bogeymen के बारे में नहीं है कि तुम पर बाहर कूद, विदेशी हमलों, या गोर के टन । यह विपरीत है । हॉरर आप अपने मन में बना । चार अक्षरों के लिए विडंबना यह है कि आतंक एक बाहरी ताकत है कि यह उन पर शक्ति है से नहीं आता है । बस, पुरुषों के लिए एक बात वे इच्छा के लिए पूछना है, और वे इसे प्राप्त.. । तो एक तरफ, वे मिल क्या वे एक मनोगत पुस्तक से चाहते हैं, लेकिन अंततः वे नहीं था चाहता हूं । कई बार एक जेल सेल में बंद किया जा रहा करने के लिए सबसे अच्छी जगह है!",10
